Unnamed: 0,List,Word,Same_sense,Sentence_1,Sentence_2,Sense_id_s1,Sense_id_s2,Gender_s1,Gender_s2,mean_relatedness,sd_relatedness,median_relatedness,count,sentence1,sentence2,same
500,7,cinta,Same Sense,Usó la cinta rosada,Usó la cinta decorativa,2,2,female,female,4.69230769230769,0.630425171956115,5.0,13,Usó la cinta rosada.,Usó la cinta decorativa.,Same Sense
501,7,clave,Different Sense,Era la clave de sol,Era la clave al caso,1,2,female,female,1.23076923076923,0.438529009653515,1.0,13,Era la clave de sol.,Era la clave al caso.,Different Sense
502,7,clave,Same Sense,Era la clave musical,Era la clave de sol,1,1,female,female,4.69230769230769,1.10940039245046,5.0,13,Era la clave musical.,Era la clave de sol.,Same Sense
503,7,colonia,Different Sense,Era una colonia de hombre,Era una colonia abandonada,1,2,female,female,1.23076923076923,0.832050294337844,1.0,13,Era una colonia de hombre.,Era una colonia abandonada.,Different Sense
504,7,colonia,Different Sense,Era una colonia sutil,Era una colonia abandonada,1,2,female,female,1.76923076923077,1.48064435037847,1.0,13,Era una colonia sutil.,Era una colonia abandonada.,Different Sense
505,7,colonia,Different Sense,Era una colonia sutil,Era una colonia bacteriana,1,3,female,female,1.53846153846154,0.877058019307029,1.0,13,Era una colonia sutil.,Era una colonia bacteriana.,Different Sense
506,7,compañía,Different Sense,Le gustó la compañía de inversiones,Le gustó la compañía teatral,1,2,female,female,3.23076923076923,1.48064435037847,4.0,13,Le gustó la compañía de inversiones.,Le gustó la compañía teatral.,Different Sense
507,7,compás,Different Sense,Él observaba el compás,Él cantaba al compás,1,2,male,male,1.76923076923077,1.09192842819834,1.0,13,Él observaba el compás.,Él cantaba al compás.,Different Sense
508,7,cordón,Same Sense,Se trataba de un cordón umbilical,Se trataba de un cordón biológico,2,2,male,male,4.15384615384615,1.21423184538991,5.0,13,Se trataba de un cordón umbilical.,Se trataba de un cordón biológico.,Same Sense
509,7,corte,Different Sense,Le gustó la corte judicial,Le gustó el corte asimétrico,2,3,female,male,1.07692307692308,0.277350098112615,1.0,13,Le gustó la corte judicial.,Le gustó el corte asimétrico.,Different Sense
510,7,corte,Different Sense,Le gustó la corte real,Le gustó el corte asimétrico,1,3,female,male,1.07692307692308,0.277350098112615,1.0,13,Le gustó la corte real.,Le gustó el corte asimétrico.,Different Sense
511,7,corte,Different Sense,Le gustó la corte real,Le gustó la corte suprema,1,2,female,female,3.92307692307692,1.55250005161237,5.0,13,Le gustó la corte real.,Le gustó la corte suprema.,Different Sense
512,7,corteza,Different Sense,Estaba en la corteza geológica,Estaba en la corteza cerebral,1,3,female,female,2.07692307692308,1.3821202589704,1.0,13,Estaba en la corteza geológica.,Estaba en la corteza cerebral.,Different Sense
513,7,corteza,Different Sense,Estaba en la corteza terrestre,Estaba en la corteza prefrontal,1,3,female,female,1.69230769230769,1.03155347127648,1.0,13,Estaba en la corteza terrestre.,Estaba en la corteza prefrontal.,Different Sense
514,7,cuadro,Different Sense,No le gustó el cuadro clíninco,No le gustó el cuadro antiguo,1,2,male,male,1.84615384615385,1.21423184538991,1.0,13,No le gustó el cuadro clíninco.,No le gustó el cuadro antiguo.,Different Sense
515,7,fibra,Different Sense,Carecía fibra nutritiva,Carecía fibra muscular,2,3,female,female,2.38461538461538,1.60926802918084,2.0,13,Carecía fibra nutritiva.,Carecía fibra muscular.,Different Sense
516,7,fondo,Same Sense,Estaba en el fondo marino,Estaba en el fondo del cuarto,2,2,male,male,3.30769230769231,1.31558702896054,3.0,13,Estaba en el fondo marino.,Estaba en el fondo del cuarto.,Same Sense
517,7,fortuna,Different Sense,Fue una fortuna financiera,Fue una fortuna inesperada,1,2,female,female,3.30769230769231,1.43669849450139,3.0,13,Fue una fortuna financiera.,Fue una fortuna inesperada.,Different Sense
518,7,frase,Different Sense,Le gustó la frase melódica,Le gustó la frase lírica,1,2,female,female,4.15384615384615,1.34450448407296,5.0,13,Le gustó la frase melódica.,Le gustó la frase lírica.,Different Sense
519,7,función,Same Sense,Era una función lineal,Era una función matemática,2,2,female,female,4.23076923076923,1.16575055606865,5.0,13,Era una función lineal.,Era una función matemática.,Same Sense
520,7,guía,Different Sense,Era una guía turística,Era una guía digital,1,2,female,female,3.15384615384615,1.46322439872551,3.0,13,Era una guía turística.,Era una guía digital.,Different Sense
521,7,hoja,Different Sense,Era una hoja de papel,Era una hoja verdosa,1,2,female,female,2.76923076923077,1.53589529557661,3.0,13,Era una hoja de papel.,Era una hoja verdosa.,Different Sense
522,7,hoja,Same Sense,Era una hoja de árbol,Era una hoja verdosa,2,2,female,female,4.53846153846154,0.660225291773525,5.0,13,Era una hoja de árbol.,Era una hoja verdosa.,Same Sense
523,7,naranja,Different Sense,Era una naranja madura,Era un naranja brillante,1,2,female,male,3.07692307692308,1.75411603861406,3.0,13,Era una naranja madura.,Era un naranja brillante.,Different Sense
524,7,naranja,Same Sense,Era un naranja oscuro,Era un naranja brillante,2,2,male,male,4.46153846153846,1.19828937903056,5.0,13,Era un naranja oscuro.,Era un naranja brillante.,Same Sense
525,7,nave,Different Sense,Era una nave marítima,Era una nave sagrada,1,2,female,female,3.0,1.73205080756888,4.0,13,Era una nave marítima.,Era una nave sagrada.,Different Sense
526,7,nota,Different Sense,Era una nota aguda,Era una nota satisfactoria,1,2,female,female,2.23076923076923,1.23516841994969,3.0,13,Era una nota aguda.,Era una nota satisfactoria.,Different Sense
527,7,nota,Different Sense,Era una nota desafinada,Era una nota académica,1,2,female,female,1.23076923076923,0.599144689515278,1.0,13,Era una nota desafinada.,Era una nota académica.,Different Sense
528,7,nota,Same Sense,Era una nota decepcionante,Era una nota satisfactoria,2,2,female,female,4.46153846153846,1.05003052458683,5.0,13,Era una nota decepcionante.,Era una nota satisfactoria.,Same Sense
529,7,ola,Same Sense,Se trataba de una ola marítima,Se trataba de una ola navegable,1,1,female,female,4.69230769230769,0.630425171956115,5.0,13,Se trataba de una ola marítima.,Se trataba de una ola navegable.,Same Sense
530,7,palma,Same Sense,Estaba en la palma frondosa,Estaba en la palma de coco,1,1,female,female,3.69230769230769,1.31558702896054,4.0,13,Estaba en la palma frondosa.,Estaba en la palma de coco.,Same Sense
531,7,papa,Different Sense,Era una papa caliente,Era un papa jesuita,1,2,female,male,1.0,0.0,1.0,13,Era una papa caliente.,Era un papa jesuita.,Different Sense
532,7,papa,Same Sense,Era un papa jesuita,Era un papa comprensivo,2,2,male,male,3.38461538461538,1.66024403519792,4.0,13,Era un papa jesuita.,Era un papa comprensivo.,Same Sense
533,7,parque,Different Sense,Visitó el parque de diversiones,Visitó el parque forestal,1,2,male,male,3.07692307692308,1.32045058354705,3.0,13,Visitó el parque de diversiones.,Visitó el parque forestal.,Different Sense
534,7,pasta,Different Sense,Le gustó la pasta caliente,Le gustó la pasta dental,1,2,female,female,1.0,0.0,1.0,13,Le gustó la pasta caliente.,Le gustó la pasta dental.,Different Sense
535,7,pasta,Same Sense,Le gustó la pasta italiana,Le gustó la pasta caliente,1,1,female,female,4.69230769230769,0.630425171956115,5.0,13,Le gustó la pasta italiana.,Le gustó la pasta caliente.,Same Sense
536,7,pata,Different Sense,Ella vio la pata de hierro,Ella vio la pata peluda,1,2,female,female,3.15384615384615,1.46322439872551,4.0,13,Ella vio la pata de hierro.,Ella vio la pata peluda.,Different Sense
537,7,patrón,Different Sense,Era un patrón exigente,Era un patrón complicado,1,2,male,male,3.61538461538462,1.44559454541846,4.0,13,Era un patrón exigente.,Era un patrón complicado.,Different Sense
538,7,patrón,Different Sense,Era un patrón orgulloso,Era un patrón geométrico,1,2,male,male,1.38461538461538,0.960768922830523,1.0,13,Era un patrón orgulloso.,Era un patrón geométrico.,Different Sense
539,7,perfil,Different Sense,Se trataba de un perfil perturbador,Se trataba de un perfil fotogénico,1,2,male,male,2.92307692307692,1.65637850251377,2.0,13,Se trataba de un perfil perturbador.,Se trataba de un perfil fotogénico.,Different Sense
540,7,perfil,Same Sense,Se trataba de un perfil fotogénico,Se trataba de un perfil elegante,2,2,male,male,3.84615384615385,1.14354374979373,4.0,13,Se trataba de un perfil fotogénico.,Se trataba de un perfil elegante.,Same Sense
541,7,periódico,Different Sense,Se trataba de un periódico global,Se trataba de un periódico estrujado,1,2,male,male,3.84615384615385,1.2810252304407,4.0,13,Se trataba de un periódico global.,Se trataba de un periódico estrujado.,Different Sense
542,7,pico,Different Sense,Dibujó el pico montuno,Dibujó el pico del ave,1,2,male,male,2.30769230769231,1.43669849450139,2.0,13,Dibujó el pico montuno.,Dibujó el pico del ave.,Different Sense
543,7,pieza,Different Sense,Le gustó la pieza musical,Le gustó la pieza contemporánea,1,3,female,female,4.0,1.29099444873581,4.0,13,Le gustó la pieza musical.,Le gustó la pieza contemporánea.,Different Sense
544,7,planta,Different Sense,Estaba en la planta tropical,Estaba en la planta izquierda,1,3,female,female,1.07692307692308,0.277350098112615,1.0,13,Estaba en la planta tropical.,Estaba en la planta izquierda.,Different Sense
545,7,pluma,Different Sense,Tenía una pluma silvestre,Tenía una pluma fuente,1,2,female,female,1.92307692307692,1.18754217199071,2.0,13,Tenía una pluma silvestre.,Tenía una pluma fuente.,Different Sense
546,7,pluma,Same Sense,Tenía una pluma silvestre,Tenía una pluma albina,1,1,female,female,4.07692307692308,1.11516355015296,4.0,13,Tenía una pluma silvestre.,Tenía una pluma albina.,Same Sense
547,7,posición,Different Sense,Estaba en una posición sentada,Estaba en una posición oportuna,1,2,female,female,2.38461538461538,1.66024403519792,1.0,13,Estaba en una posición sentada.,Estaba en una posición oportuna.,Different Sense
548,7,prima,Different Sense,Era una prima anual,Era una prima hermana,1,2,female,female,1.07692307692308,0.277350098112615,1.0,13,Era una prima anual.,Era una prima hermana.,Different Sense
549,7,prima,Different Sense,Era una prima costosa,Era una prima atenta,1,2,female,female,1.61538461538462,0.960768922830523,1.0,13,Era una prima costosa.,Era una prima atenta.,Different Sense
550,7,químico,Same Sense,Era un químico negligente,Era un químico exitoso,1,1,male,male,4.61538461538461,0.869718492622904,5.0,13,Era un químico negligente.,Era un químico exitoso.,Same Sense
551,7,red,Same Sense,Era una red pesquera,Era una red de cuerda,2,2,female,female,4.53846153846154,0.518874521662771,5.0,13,Era una red pesquera.,Era una red de cuerda.,Same Sense
552,7,redada,Different Sense,Fue una redada en el río,Fue una redada policiaca,1,2,female,female,2.23076923076923,1.01273936708367,2.0,13,Fue una redada en el río.,Fue una redada policiaca.,Different Sense
553,7,redada,Different Sense,Fue una redada pesquera,Fue una redada policiaca,1,2,female,female,1.76923076923077,1.23516841994969,1.0,13,Fue una redada pesquera.,Fue una redada policiaca.,Different Sense
554,7,resistencia,Different Sense,Se trataba de una resistencia eléctrica,Se trataba de una resistencia política,1,2,female,female,1.38461538461538,0.869718492622904,1.0,13,Se trataba de una resistencia eléctrica.,Se trataba de una resistencia política.,Different Sense
555,7,revista,Same Sense,Era una revista de belleza,Era una revista deportiva,1,1,female,female,4.84615384615385,0.554700196225229,5.0,13,Era una revista de belleza.,Era una revista deportiva.,Same Sense
556,7,rosa,Different Sense,Era una rosa fragante,Era un rosa tenue,1,2,female,male,2.92307692307692,1.4978617237882,3.0,13,Era una rosa fragante.,Era un rosa tenue.,Different Sense
557,7,rosa,Different Sense,Era una rosa frágil,Era un rosa claro,1,2,female,male,1.76923076923077,1.23516841994969,1.0,13,Era una rosa frágil.,Era un rosa claro.,Different Sense
558,7,semilla,Different Sense,Era una semilla educativa,Era una semilla sembrada,1,2,female,female,1.84615384615385,1.21423184538991,1.0,13,Era una semilla educativa.,Era una semilla sembrada.,Different Sense
559,7,semilla,Same Sense,Era una semilla educativa,Era una semilla cultural,1,1,female,female,4.0,1.52752523165195,5.0,13,Era una semilla educativa.,Era una semilla cultural.,Same Sense
560,7,serie,Different Sense,Se trataba de una serie animada,Se trataba de una serie numérica,1,2,female,female,1.76923076923077,1.16575055606865,1.0,13,Se trataba de una serie animada.,Se trataba de una serie numérica.,Different Sense
561,7,sierra,Same Sense,Era una sierra forestada,Era una sierra nevada,2,2,female,female,4.61538461538461,0.869718492622904,5.0,13,Era una sierra forestada.,Era una sierra nevada.,Same Sense
562,7,sirena,Different Sense,Era una sirena mitológica,Era una sirena policíaca,1,2,female,female,1.0,0.0,1.0,13,Era una sirena mitológica.,Era una sirena policíaca.,Different Sense
563,7,sirena,Same Sense,Era una sirena policíaca,Era una sirena ruidosa,2,2,female,female,4.0,1.35400640077266,5.0,13,Era una sirena policíaca.,Era una sirena ruidosa.,Same Sense
564,7,tecla,Same Sense,Tocó la tecla del ordenador,Tocó la tecla espaciadora,1,1,female,female,4.92307692307692,0.277350098112615,5.0,13,Tocó la tecla del ordenador.,Tocó la tecla espaciadora.,Same Sense
565,7,título,Different Sense,Le gustó el título del libro,Le gustó el título legal,2,3,male,male,2.38461538461538,1.66024403519792,2.0,13,Le gustó el título del libro.,Le gustó el título legal.,Different Sense
566,7,título,Different Sense,Le gustó el título del poema,Le gustó el título legal,2,3,male,male,2.23076923076923,1.36344209960466,2.0,13,Le gustó el título del poema.,Le gustó el título legal.,Different Sense
567,7,vela,Different Sense,Ella vio la vela del barco,Ella vio la vela de cera,1,2,female,female,1.07692307692308,0.277350098112615,1.0,13,Ella vio la vela del barco.,Ella vio la vela de cera.,Different Sense
568,7,vela,Same Sense,Ella vio la vela del barco,Ella vio la vela de lona,1,1,female,female,4.23076923076923,0.926808695996298,5.0,13,Ella vio la vela del barco.,Ella vio la vela de lona.,Same Sense
569,7,volumen,Same Sense,Aumentó el volumen de la voz,Aumentó el volumen de la bocina,2,2,male,male,4.38461538461539,1.50213523239762,5.0,13,Aumentó el volumen de la voz.,Aumentó el volumen de la bocina.,Same Sense
570,8,algodón,Different Sense,Evaluó el algodón sembrado,Evaluó el algodón caramelizado,1,2,male,male,1.9,1.28668393770792,1.0,10,Evaluó el algodón sembrado.,Evaluó el algodón caramelizado.,Different Sense
571,8,baño,Different Sense,Disfrutó el baño frío,Disfrutó el baño remodelado,1,2,male,male,2.0,0.816496580927726,2.0,10,Disfrutó el baño frío.,Disfrutó el baño remodelado.,Different Sense
572,8,cadena,Same Sense,Era una cadena de hierro,Era una cadena de reo,2,2,female,female,4.1,1.10050493461461,4.5,10,Era una cadena de hierro.,Era una cadena de reo.,Same Sense
573,8,caja,Different Sense,Ella vio la caja registradora,Ella vio la caja fuerte,1,2,female,female,3.4,1.34989711542111,4.0,10,Ella vio la caja registradora.,Ella vio la caja fuerte.,Different Sense
574,8,caja,Same Sense,Ella vio la caja acústica,Ella vio la caja percusiva,3,3,female,female,4.4,1.26491106406735,5.0,10,Ella vio la caja acústica.,Ella vio la caja percusiva.,Same Sense
575,8,caja,Same Sense,Ella vio la caja fuerte,Ella vio la caja sellada,2,2,female,female,3.3,1.70293863659264,3.5,10,Ella vio la caja fuerte.,Ella vio la caja sellada.,Same Sense
576,8,caja,Same Sense,Ella vio la caja registradora,Ella vio la caja bancaria,1,1,female,female,3.4,1.17378779077727,4.0,10,Ella vio la caja registradora.,Ella vio la caja bancaria.,Same Sense
577,8,cámara,Different Sense,Se trataba de la cámara senatorial,Se trataba de la cámara profesional,1,2,female,female,1.7,1.05934990547138,1.0,10,Se trataba de la cámara senatorial.,Se trataba de la cámara profesional.,Different Sense
578,8,cámara,Same Sense,Se trataba de la cámara profesional,Se trataba de la cámara digital,2,2,female,female,3.9,1.66332999331662,5.0,10,Se trataba de la cámara profesional.,Se trataba de la cámara digital.,Same Sense
579,8,canal,Different Sense,Estaba en el canal de comedia,Estaba en el canal marítimo,1,2,male,male,1.2,0.632455532033676,1.0,10,Estaba en el canal de comedia.,Estaba en el canal marítimo.,Different Sense
580,8,canal,Different Sense,Estaba en el canal televisivo,Estaba en el canal marítimo,1,2,male,male,1.5,0.849836585598797,1.0,10,Estaba en el canal televisivo.,Estaba en el canal marítimo.,Different Sense
581,8,capital,Same Sense,Le gustó el capital financiero,Le gustó el capital económico,2,2,male,male,4.8,0.632455532033676,5.0,10,Le gustó el capital financiero.,Le gustó el capital económico.,Same Sense
582,8,carrera,Different Sense,Fue una carrera profesional,Fue una carrera benéfica,1,2,female,female,1.9,1.19721899973786,1.0,10,Fue una carrera profesional.,Fue una carrera benéfica.,Different Sense
583,8,casco,Different Sense,Le gustó el casco protector,Le gustó el casco urbano,1,2,male,male,1.2,0.421637021355784,1.0,10,Le gustó el casco protector.,Le gustó el casco urbano.,Different Sense
584,8,casco,Same Sense,Le gustó el casco protector,Le gustó el casco de la ciclista,1,1,male,male,4.9,0.316227766016838,5.0,10,Le gustó el casco protector.,Le gustó el casco de la ciclista.,Same Sense
585,8,caudal,Different Sense,Era un caudal financiero,Era un caudal ecológico,1,2,male,male,1.3,0.483045891539648,1.0,10,Era un caudal financiero.,Era un caudal ecológico.,Different Sense
586,8,caudal,Different Sense,Era un caudal heredado,Era un caudal ambiental,1,2,male,male,1.8,0.918936583472681,1.5,10,Era un caudal heredado.,Era un caudal ambiental.,Different Sense
587,8,cinta,Different Sense,Usó la cinta pegante,Usó la cinta quirúrgica,1,4,female,female,3.4,1.34989711542111,4.0,10,Usó la cinta pegante.,Usó la cinta quirúrgica.,Different Sense
588,8,clima,Different Sense,El clima estaba amigable,El clima estaba frío,1,2,male,male,4.3,1.25166555703457,5.0,10,El clima estaba amigable.,El clima estaba frío.,Different Sense
589,8,código,Same Sense,Era un código de ética,Era un código de conducta,1,1,male,male,4.8,0.632455532033676,5.0,10,Era un código de ética.,Era un código de conducta.,Same Sense
590,8,colonia,Different Sense,Era una colonia fragante,Era una colonia bacteriana,1,3,female,female,2.0,1.63299316185545,1.0,10,Era una colonia fragante.,Era una colonia bacteriana.,Different Sense
591,8,colonia,Same Sense,Era una colonia oprimida,Era una colonia abandonada,2,2,female,female,4.2,0.918936583472681,4.0,10,Era una colonia oprimida.,Era una colonia abandonada.,Same Sense
592,8,copa,Different Sense,Él vio la copa deportiva,Él vio la copa de cristal,1,2,female,female,1.7,1.33749350984926,1.0,10,Él vio la copa deportiva.,Él vio la copa de cristal.,Different Sense
593,8,copa,Different Sense,Él vio la copa mundial,Él vio la copa de cristal,1,2,female,female,1.4,0.516397779494322,1.0,10,Él vio la copa mundial.,Él vio la copa de cristal.,Different Sense
594,8,copa,Different Sense,Él vio la copa mundial,Él vio la copa llena,1,2,female,female,1.2,0.421637021355784,1.0,10,Él vio la copa mundial.,Él vio la copa llena.,Different Sense
595,8,copa,Same Sense,Él vio la copa llena,Él vio la copa de cristal,2,2,female,female,4.5,0.707106781186548,5.0,10,Él vio la copa llena.,Él vio la copa de cristal.,Same Sense
596,8,corazón,Same Sense,Tenía el corazón partido,Tenía el corazón angustiado,1,1,male,male,4.3,1.25166555703457,5.0,10,Tenía el corazón partido.,Tenía el corazón angustiado.,Same Sense
597,8,cordón,Different Sense,Se trataba de un cordón biológico,Se trataba de un cordón eléctrico,2,3,male,male,1.5,0.849836585598797,1.0,10,Se trataba de un cordón biológico.,Se trataba de un cordón eléctrico.,Different Sense
598,8,cordón,Different Sense,Se trataba de un cordón de lona,Se trataba de un cordón biológico,1,2,male,male,1.4,0.843274042711568,1.0,10,Se trataba de un cordón de lona.,Se trataba de un cordón biológico.,Different Sense
599,8,cordón,Same Sense,Se trataba de un cordón eléctrico,Se trataba de un cordón inalámbrico,3,3,male,male,3.6,1.50554530541816,4.0,10,Se trataba de un cordón eléctrico.,Se trataba de un cordón inalámbrico.,Same Sense
600,8,corte,Different Sense,Le gustó la corte real,Le gustó el corte de pelo,1,3,female,male,1.3,0.948683298050514,1.0,10,Le gustó la corte real.,Le gustó el corte de pelo.,Different Sense
601,8,corte,Same Sense,Le gustó el corte de pelo,Le gustó el corte asimétrico,3,3,male,male,3.3,1.49443411809733,3.0,10,Le gustó el corte de pelo.,Le gustó el corte asimétrico.,Same Sense
602,8,corteza,Different Sense,Estaba en la corteza del roble,Estaba en la corteza comestible,2,4,female,female,3.6,1.42984070596848,3.5,10,Estaba en la corteza del roble.,Estaba en la corteza comestible.,Different Sense
603,8,cuadro,Same Sense,No le gustó el cuadro pintoresco,No le gustó el cuadro barroco,2,2,male,male,4.9,0.316227766016838,5.0,10,No le gustó el cuadro pintoresco.,No le gustó el cuadro barroco.,Same Sense
604,8,cuerdas,Different Sense,Tenía cuerdas fibrosas,Tenía cuerdas de terreno,1,2,female,female,1.4,0.699205898780101,1.0,10,Tenía cuerdas fibrosas.,Tenía cuerdas de terreno.,Different Sense
605,8,cuerdas,Different Sense,Tenía cuerdas fibrosas,Tenía cuerdas forestadas,1,2,female,female,2.4,1.07496769977314,3.0,10,Tenía cuerdas fibrosas.,Tenía cuerdas forestadas.,Different Sense
606,8,depresión,Same Sense,Se trataba de una depresión mental,Se trataba de una depresión psicológica,2,2,female,female,5.0,0.0,5.0,10,Se trataba de una depresión mental.,Se trataba de una depresión psicológica.,Same Sense
607,8,fibra,Different Sense,Carecía fibra dietética,Carecía fibra óptica,2,4,female,female,1.1,0.316227766016838,1.0,10,Carecía fibra dietética.,Carecía fibra óptica.,Different Sense
608,8,firma,Same Sense,Era una firma caligráfica,Era una firma indescifrable,1,1,female,female,4.5,0.849836585598797,5.0,10,Era una firma caligráfica.,Era una firma indescifrable.,Same Sense
609,8,fondo,Different Sense,Estaba en el fondo gubernamental,Estaba en el fondo marino,1,2,male,male,1.5,1.08012344973464,1.0,10,Estaba en el fondo gubernamental.,Estaba en el fondo marino.,Different Sense
610,8,frase,Different Sense,Le gustó la frase melódica,Le gustó la frase poética,1,2,female,female,4.3,1.33749350984926,5.0,10,Le gustó la frase melódica.,Le gustó la frase poética.,Different Sense
611,8,frente,Different Sense,Era un frente frío,Era una frente amplia,1,2,male,female,1.7,1.33749350984926,1.0,10,Era un frente frío.,Era una frente amplia.,Different Sense
612,8,guardia,Different Sense,Llamó al guardia de seguridad,Llamó a la guardia costanera,1,2,male,female,4.4,1.26491106406735,5.0,10,Llamó al guardia de seguridad.,Llamó a la guardia costanera.,Different Sense
613,8,lengua,Same Sense,Le gusta la lengua castellana,Le gusta la lengua española,1,1,female,female,5.0,0.0,5.0,10,Le gusta la lengua castellana.,Le gusta la lengua española.,Same Sense
614,8,llama,Same Sense,Era una llama peruana,Era una llama lanuda,2,2,female,female,4.5,1.26929551764398,5.0,10,Era una llama peruana.,Era una llama lanuda.,Same Sense
615,8,mano,Different Sense,Tenía una mano de hierro,Tenía una mano lastimada,1,2,female,female,2.9,1.44913767461894,3.0,10,Tenía una mano de hierro.,Tenía una mano lastimada.,Different Sense
616,8,mano,Same Sense,Tenía una mano lastimada,Tenía una mano arrugada,2,2,female,female,4.8,0.421637021355784,5.0,10,Tenía una mano lastimada.,Tenía una mano arrugada.,Same Sense
617,8,muñeca,Different Sense,Tenía una muñeca lesionada,Tenía una muñeca preciosa,1,2,female,female,1.4,0.699205898780101,1.0,10,Tenía una muñeca lesionada.,Tenía una muñeca preciosa.,Different Sense
618,8,naranja,Same Sense,Era una naranja jugosa,Era una naranja madura,1,1,female,female,5.0,0.0,5.0,10,Era una naranja jugosa.,Era una naranja madura.,Same Sense
619,8,nave,Different Sense,Era una nave de madera,Era una nave católica,1,2,female,female,1.8,0.918936583472681,1.5,10,Era una nave de madera.,Era una nave católica.,Different Sense
620,8,nota,Different Sense,Era una nota desafinada,Era una nota satisfactoria,1,2,female,female,2.9,1.72884033065199,2.5,10,Era una nota desafinada.,Era una nota satisfactoria.,Different Sense
621,8,nota,Same Sense,Era una nota aguda,Era una nota musical,1,1,female,female,4.7,0.674948557710553,5.0,10,Era una nota aguda.,Era una nota musical.,Same Sense
622,8,ola,Different Sense,Se trataba de una ola marítima,Se trataba de una ola migratoria,1,2,female,female,1.6,0.843274042711568,1.0,10,Se trataba de una ola marítima.,Se trataba de una ola migratoria.,Different Sense
623,8,órgano,Different Sense,Tenía un órgano ceremonial,Tenía un órgano operado,1,2,male,male,1.1,0.316227766016838,1.0,10,Tenía un órgano ceremonial.,Tenía un órgano operado.,Different Sense
624,8,palma,Different Sense,Estaba en la palma de coco,Estaba en la palma izquierda,1,2,female,female,1.5,0.707106781186548,1.0,10,Estaba en la palma de coco.,Estaba en la palma izquierda.,Different Sense
625,8,papa,Same Sense,Era un papa comprensivo,Era un papa conservador,2,2,male,male,4.7,0.483045891539648,5.0,10,Era un papa comprensivo.,Era un papa conservador.,Same Sense
626,8,papel,Different Sense,Era un papel cuadriculado,Era un papel principal,1,2,male,male,1.5,1.26929551764398,1.0,10,Era un papel cuadriculado.,Era un papel principal.,Different Sense
