Unnamed: 0,List,Word,Same_sense,Sentence_1,Sentence_2,Sense_id_s1,Sense_id_s2,Gender_s1,Gender_s2,mean_relatedness,sd_relatedness,median_relatedness,count,sentence1,sentence2,same
372,5,mano,Different Sense,Tenía una mano de hierro,Tenía una mano sudada,1,2,female,female,3.28571428571429,1.81568259800641,3.5,14,Tenía una mano de hierro.,Tenía una mano sudada.,Different Sense
373,5,nave,Different Sense,Era una nave de madera,Era una nave sagrada,1,2,female,female,3.07142857142857,1.43924583425785,4.0,14,Era una nave de madera.,Era una nave sagrada.,Different Sense
374,5,nave,Same Sense,Era una nave católica,Era una nave sagrada,2,2,female,female,3.85714285714286,1.23145585242976,4.0,14,Era una nave católica.,Era una nave sagrada.,Same Sense
375,5,nota,Same Sense,Era una nota desafinada,Era una nota musical,1,1,female,female,5.0,0.0,5.0,14,Era una nota desafinada.,Era una nota musical.,Same Sense
376,5,orden,Different Sense,Es una orden jurídica,Es una orden católica,1,2,female,female,1.85714285714286,1.56190922897601,1.0,14,Es una orden jurídica.,Es una orden católica.,Different Sense
377,5,orden,Different Sense,Es una orden jurídica,Es una orden religiosa,1,2,female,female,1.78571428571429,1.3114039117603,1.0,14,Es una orden jurídica.,Es una orden religiosa.,Different Sense
378,5,órgano,Different Sense,Tenía un órgano ceremonial,Tenía un órgano herido,1,2,male,male,1.07142857142857,0.267261241912424,1.0,14,Tenía un órgano ceremonial.,Tenía un órgano herido.,Different Sense
379,5,órgano,Different Sense,Tenía un órgano eclesiástico,Tenía un órgano herido,1,2,male,male,1.14285714285714,0.534522483824849,1.0,14,Tenía un órgano eclesiástico.,Tenía un órgano herido.,Different Sense
380,5,órgano,Same Sense,Tenía un órgano herido,Tenía un órgano operado,2,2,male,male,5.0,0.0,5.0,14,Tenía un órgano herido.,Tenía un órgano operado.,Same Sense
381,5,papa,Different Sense,Era una papa majada,Era un papa comprensivo,1,2,female,male,1.0,0.0,1.0,14,Era una papa majada.,Era un papa comprensivo.,Different Sense
382,5,papa,Different Sense,Era una papa majada,Era un papa conservador,1,2,female,male,1.0,0.0,1.0,14,Era una papa majada.,Era un papa conservador.,Different Sense
383,5,pasta,Different Sense,Le gustó la pasta italiana,Le gustó la pasta dental,1,2,female,female,1.07142857142857,0.267261241912424,1.0,14,Le gustó la pasta italiana.,Le gustó la pasta dental.,Different Sense
384,5,perfil,Different Sense,Se trataba de un perfil perturbador,Se trataba de un perfil elegante,1,2,male,male,3.78571428571429,1.47692880035521,4.5,14,Se trataba de un perfil perturbador.,Se trataba de un perfil elegante.,Different Sense
385,5,pieza,Different Sense,Le gustó la pieza alterada,Le gustó la pieza contemporánea,2,3,female,female,2.78571428571429,1.1217137594956,2.5,14,Le gustó la pieza alterada.,Le gustó la pieza contemporánea.,Different Sense
386,5,pieza,Different Sense,Le gustó la pieza añadida,Le gustó la pieza abstracta,2,3,female,female,3.57142857142857,1.28388147753274,4.0,14,Le gustó la pieza añadida.,Le gustó la pieza abstracta.,Different Sense
387,5,pieza,Different Sense,Le gustó la pieza musical,Le gustó la pieza alterada,1,2,female,female,2.5,1.40054934277178,2.0,14,Le gustó la pieza musical.,Le gustó la pieza alterada.,Different Sense
388,5,pieza,Same Sense,Le gustó la pieza musical,Le gustó la pieza flamenca,1,1,female,femael,4.71428571428571,0.611249845502127,5.0,14,Le gustó la pieza musical.,Le gustó la pieza flamenca.,Same Sense
389,5,pista,Different Sense,Era una pista de baile,Era una pista clave,1,2,female,female,1.0,0.0,1.0,14,Era una pista de baile.,Era una pista clave.,Different Sense
390,5,planta,Different Sense,Estaba en la planta baja,Estaba en la planta izquierda,2,3,female,female,2.78571428571429,1.67233468441676,3.0,14,Estaba en la planta baja.,Estaba en la planta izquierda.,Different Sense
391,5,planta,Different Sense,Estaba en la planta superior,Estaba en la planta del pie,2,3,female,female,1.14285714285714,0.363136519601281,1.0,14,Estaba en la planta superior.,Estaba en la planta del pie.,Different Sense
392,5,planta,Different Sense,Estaba en la planta tropical,Estaba en la planta baja,1,2,female,female,1.0,0.0,1.0,14,Estaba en la planta tropical.,Estaba en la planta baja.,Different Sense
393,5,red,Different Sense,Era una red privada,Era una red de cuerda,1,2,female,female,1.07142857142857,0.267261241912424,1.0,14,Era una red privada.,Era una red de cuerda.,Different Sense
394,5,resistencia,Different Sense,Se trataba de una resistencia de circuito,Se trataba de una resistencia militar,1,2,female,female,1.42857142857143,1.15786844704368,1.0,14,Se trataba de una resistencia de circuito.,Se trataba de una resistencia militar.,Different Sense
395,5,resistencia,Same Sense,Se trataba de una resistencia eléctrica,Se trataba de una resistencia de circuito,1,1,female,female,4.71428571428571,0.468807230938495,5.0,14,Se trataba de una resistencia eléctrica.,Se trataba de una resistencia de circuito.,Same Sense
396,5,resistencia,Same Sense,Se trataba de una resistencia política,Se trataba de una resistencia militar,2,2,female,female,4.21428571428571,0.974961255922229,4.5,14,Se trataba de una resistencia política.,Se trataba de una resistencia militar.,Same Sense
397,5,rosa,Different Sense,Era una rosa frágil,Era un rosa tenue,1,2,female,male,2.0,1.46759877141069,1.0,14,Era una rosa frágil.,Era un rosa tenue.,Different Sense
398,5,sangre,Different Sense,Él tiene sangre diluida,Él tiene sangre real,1,2,female,female,3.64285714285714,1.49908396938022,4.0,14,Él tiene sangre diluida.,Él tiene sangre real.,Different Sense
399,5,seno,Same Sense,Estaba en el seno izquiero,Estaba en el seno operado,2,2,male,male,3.85714285714286,1.51185789203691,4.5,14,Estaba en el seno izquiero.,Estaba en el seno operado.,Same Sense
400,5,sirena,Different Sense,Era una sirena coqueta,Era una sirena policíaca,1,2,female,female,1.14285714285714,0.534522483824849,1.0,14,Era una sirena coqueta.,Era una sirena policíaca.,Different Sense
401,5,sirena,Same Sense,Era una sirena mitológica,Era una sirena coqueta,1,1,female,female,4.57142857142857,0.755928946018454,5.0,14,Era una sirena mitológica.,Era una sirena coqueta.,Same Sense
402,5,sueño,Different Sense,Él abandonó su sueño,Él relató su sueño,1,3,male,male,3.0,1.46759877141069,3.0,14,Él abandonó su sueño.,Él relató su sueño.,Different Sense
403,5,sueño,Different Sense,Él tenía sueño,Él recordó su sueño,2,3,male,male,3.21428571428571,1.52812461375532,3.5,14,Él tenía sueño.,Él recordó su sueño.,Different Sense
404,5,sueño,Different Sense,Él tenía sueño,Él relató su sueño,2,3,male,male,2.64285714285714,1.5984195491,2.5,14,Él tenía sueño.,Él relató su sueño.,Different Sense
405,5,tabla,Same Sense,Le gustó la tabla de ajedrez,Le gustó la tabla de juego,2,2,female,female,4.28571428571429,1.43733575268066,5.0,14,Le gustó la tabla de ajedrez.,Le gustó la tabla de juego.,Same Sense
406,5,tecla,Different Sense,Tocó la tecla espaciadora,Tocó la tecla afinada,1,2,female,female,2.28571428571429,1.54065777303929,1.5,14,Tocó la tecla espaciadora.,Tocó la tecla afinada.,Different Sense
407,5,volumen,Different Sense,Aumentó el volumen de la corriente,Aumentó el volumen de la voz,1,2,male,male,1.85714285714286,0.949262293098647,1.5,14,Aumentó el volumen de la corriente.,Aumentó el volumen de la voz.,Different Sense
408,6,ala,Different Sense,Le gustó el ala remodelada,Le gustó el ala plumosa,1,2,female,female,1.4,0.516397779494322,1.0,10,Le gustó el ala remodelada.,Le gustó el ala plumosa.,Different Sense
409,6,cadena,Different Sense,Era una cadena de hierro,Era una cadena de radio,2,3,female,female,1.4,0.699205898780101,1.0,10,Era una cadena de hierro.,Era una cadena de radio.,Different Sense
410,6,caja,Different Sense,Ella vio la caja bancaria,Ella vio la caja sellada,1,2,female,female,2.5,1.43372087784044,2.0,10,Ella vio la caja bancaria.,Ella vio la caja sellada.,Different Sense
411,6,caja,Different Sense,Ella vio la caja fuerte,Ella vio la caja acústica,2,3,female,female,2.3,0.948683298050514,2.0,10,Ella vio la caja fuerte.,Ella vio la caja acústica.,Different Sense
412,6,campo,Different Sense,Era un campo biológico,Era un campo abandonado,1,2,male,male,2.0,1.05409255338946,2.0,10,Era un campo biológico.,Era un campo abandonado.,Different Sense
413,6,campo,Different Sense,Era un campo biológico,Era un campo cultivado,1,2,male,male,2.6,1.34989711542111,3.0,10,Era un campo biológico.,Era un campo cultivado.,Different Sense
414,6,campo,Different Sense,Era un campo competitivo,Era un campo abandonado,1,2,male,male,2.1,1.28668393770792,2.0,10,Era un campo competitivo.,Era un campo abandonado.,Different Sense
415,6,canal,Different Sense,Estaba en el canal televisivo,Estaba en el canal cervical,1,3,male,male,1.6,0.966091783079296,1.0,10,Estaba en el canal televisivo.,Estaba en el canal cervical.,Different Sense
416,6,canal,Same Sense,Estaba en el canal televisivo,Estaba en el canal de comedia,1,1,male,male,4.5,0.52704627669473,4.5,10,Estaba en el canal televisivo.,Estaba en el canal de comedia.,Same Sense
417,6,capa,Same Sense,Se trataba de la capa de superhéroe,Se trataba de la capa de tela,1,1,female,female,4.2,1.22927259430572,4.5,10,Se trataba de la capa de superhéroe.,Se trataba de la capa de tela.,Same Sense
418,6,capital,Different Sense,Le gustó la capital holandesa,Le gustó el capital financiero,1,2,female,male,1.3,0.674948557710553,1.0,10,Le gustó la capital holandesa.,Le gustó el capital financiero.,Different Sense
419,6,carrera,Different Sense,Fue una carrera profesional,Fue una carrera olímpica,1,2,female,female,2.3,1.49443411809733,2.0,10,Fue una carrera profesional.,Fue una carrera olímpica.,Different Sense
420,6,carrera,Same Sense,Fue una carrera reñida,Fue una carrera olímpica,2,2,female,female,4.0,1.05409255338946,4.0,10,Fue una carrera reñida.,Fue una carrera olímpica.,Same Sense
421,6,cinta,Different Sense,Usó la cinta adhesiva,Usó la cinta rosada,1,2,female,female,2.4,1.34989711542111,3.0,10,Usó la cinta adhesiva.,Usó la cinta rosada.,Different Sense
422,6,cinta,Different Sense,Usó la cinta métrica,Usó la cinta quirúrgica,3,4,female,female,2.2,0.632455532033676,2.0,10,Usó la cinta métrica.,Usó la cinta quirúrgica.,Different Sense
423,6,código,Different Sense,Era un código de conducta,Era un código programático,1,2,male,male,2.6,1.17378779077727,3.0,10,Era un código de conducta.,Era un código programático.,Different Sense
424,6,código,Different Sense,Era un código de ética,Era un código programático,1,2,male,male,2.4,1.26491106406735,2.5,10,Era un código de ética.,Era un código programático.,Different Sense
425,6,colonia,Different Sense,Era una colonia de hombre,Era una colonia oprimida,1,2,female,female,1.2,0.421637021355784,1.0,10,Era una colonia de hombre.,Era una colonia oprimida.,Different Sense
426,6,colonia,Different Sense,Era una colonia fragante,Era una colonia oprimida,1,2,female,female,1.8,0.918936583472681,1.5,10,Era una colonia fragante.,Era una colonia oprimida.,Different Sense
427,6,colonia,Same Sense,Era una colonia sutil,Era una colonia de hombre,1,1,female,female,3.9,1.59513148186739,4.5,10,Era una colonia sutil.,Era una colonia de hombre.,Same Sense
428,6,compañía,Different Sense,Le gustó la compañía financiera,Le gustó la compañía teatral,1,2,female,female,2.9,1.3703203194063,3.0,10,Le gustó la compañía financiera.,Le gustó la compañía teatral.,Different Sense
429,6,compás,Same Sense,Él navegaba con el compás,Él observaba el compás,1,1,male,male,2.4,1.34989711542111,2.5,10,Él navegaba con el compás.,Él observaba el compás.,Same Sense
430,6,corte,Different Sense,Le gustó la corte noble,Le gustó el corte asimétrico,1,3,female,male,1.3,0.483045891539648,1.0,10,Le gustó la corte noble.,Le gustó el corte asimétrico.,Different Sense
431,6,corte,Different Sense,Le gustó la corte noble,Le gustó la corte suprema,1,2,female,female,3.7,1.05934990547138,4.0,10,Le gustó la corte noble.,Le gustó la corte suprema.,Different Sense
432,6,corte,Different Sense,Le gustó la corte real,Le gustó la corte judicial,1,2,female,female,3.5,1.35400640077266,4.0,10,Le gustó la corte real.,Le gustó la corte judicial.,Different Sense
433,6,cuadro,Different Sense,No le gustó el cuadro de síntomas,No le gustó el cuadro barroco,1,2,male,male,1.4,0.699205898780101,1.0,10,No le gustó el cuadro de síntomas.,No le gustó el cuadro barroco.,Different Sense
434,6,cuadro,Different Sense,No le gustó el cuadro diagnóstico,No le gustó el cuadro barroco,1,2,male,male,1.5,0.849836585598797,1.0,10,No le gustó el cuadro diagnóstico.,No le gustó el cuadro barroco.,Different Sense
435,6,cuadro,Same Sense,No le gustó el cuadro antiguo,No le gustó el cuadro barroco,2,2,male,male,4.4,1.07496769977314,5.0,10,No le gustó el cuadro antiguo.,No le gustó el cuadro barroco.,Same Sense
436,6,cubo,Different Sense,Le gustó el cubo tridimensional,Le gustó el cubo de madera,1,2,male,male,3.4,1.17378779077727,3.0,10,Le gustó el cubo tridimensional.,Le gustó el cubo de madera.,Different Sense
437,6,cuerdas,Different Sense,Tenía cuerdas sintéticas,Tenía cuerdas inflamadas,1,3,female,female,1.3,0.483045891539648,1.0,10,Tenía cuerdas sintéticas.,Tenía cuerdas inflamadas.,Different Sense
438,6,cuerdas,Same Sense,Tenía cuerdas fibrosas,Tenía cuerdas sintéticas,1,1,female,female,3.7,1.05934990547138,4.0,10,Tenía cuerdas fibrosas.,Tenía cuerdas sintéticas.,Same Sense
439,6,depresión,Different Sense,Se trataba de una depresión terrestre,Se trataba de una depresión mental,1,2,female,female,1.3,0.483045891539648,1.0,10,Se trataba de una depresión terrestre.,Se trataba de una depresión mental.,Different Sense
440,6,fibra,Same Sense,Carecía fibra nutritiva,Carecía fibra dietética,2,2,female,female,4.2,1.22927259430572,4.5,10,Carecía fibra nutritiva.,Carecía fibra dietética.,Same Sense
441,6,fondo,Different Sense,Estaba en el fondo presupuestario,Estaba en el fondo del cuarto,1,2,male,male,1.6,0.699205898780101,1.5,10,Estaba en el fondo presupuestario.,Estaba en el fondo del cuarto.,Different Sense
442,6,función,Same Sense,Era una función biológica,Era una función social,1,1,female,female,3.1,1.44913767461894,3.0,10,Era una función biológica.,Era una función social.,Same Sense
443,6,gato,Different Sense,Compró el gato peludo,Compró el gato hidraúlico,1,2,male,male,1.0,0.0,1.0,10,Compró el gato peludo.,Compró el gato hidraúlico.,Different Sense
444,6,guardia,Different Sense,Llamó al guardia de seguridad,Llamó a la guardia nacional,1,2,male,female,3.7,1.05934990547138,3.5,10,Llamó al guardia de seguridad.,Llamó a la guardia nacional.,Different Sense
445,6,guardia,Same Sense,Llamó al guardia de seguridad,Llamó al guardia de noche,1,1,male,male,4.8,0.421637021355784,5.0,10,Llamó al guardia de seguridad.,Llamó al guardia de noche.,Same Sense
446,6,guía,Different Sense,Era una guía viajera,Era una guía digital,1,2,female,female,3.0,1.15470053837925,3.0,10,Era una guía viajera.,Era una guía digital.,Different Sense
447,6,guía,Different Sense,Era una guía viajera,Era una guía televisiva,1,2,female,female,3.2,1.22927259430572,3.0,10,Era una guía viajera.,Era una guía televisiva.,Different Sense
448,6,guía,Same Sense,Era una guía digital,Era una guía televisiva,2,2,female,female,2.6,1.07496769977314,3.0,10,Era una guía digital.,Era una guía televisiva.,Same Sense
449,6,hábito,Same Sense,Era un hábito irritante,Era un hábito rutinario,1,1,male,male,4.8,0.421637021355784,5.0,10,Era un hábito irritante.,Era un hábito rutinario.,Same Sense
450,6,llama,Different Sense,Era una llama ardiente,Era una llama peruana,1,2,female,female,1.2,0.421637021355784,1.0,10,Era una llama ardiente.,Era una llama peruana.,Different Sense
451,6,llama,Different Sense,Era una llama brillante,Era una llama lanuda,1,2,female,female,1.4,0.699205898780101,1.0,10,Era una llama brillante.,Era una llama lanuda.,Different Sense
452,6,muñeca,Different Sense,Tenía una muñeca lesionada,Tenía una muñeca plástica,1,2,female,female,1.7,1.05934990547138,1.0,10,Tenía una muñeca lesionada.,Tenía una muñeca plástica.,Different Sense
453,6,muñeca,Same Sense,Tenía una muñeca preciosa,Tenía una muñeca plástica,2,2,female,female,3.7,1.41813649241218,4.0,10,Tenía una muñeca preciosa.,Tenía una muñeca plástica.,Same Sense
454,6,nave,Different Sense,Era una nave marítima,Era una nave católica,1,2,female,female,2.3,1.15950180872841,2.0,10,Era una nave marítima.,Era una nave católica.,Different Sense
455,6,nota,Different Sense,Era una nota aguda,Era una nota decepcionante,1,2,female,female,1.9,1.10050493461461,1.5,10,Era una nota aguda.,Era una nota decepcionante.,Different Sense
456,6,nota,Different Sense,Era una nota desafinada,Era una nota decepcionante,1,2,female,female,1.8,1.03279555898864,1.5,10,Era una nota desafinada.,Era una nota decepcionante.,Different Sense
457,6,nota,Different Sense,Era una nota musical,Era una nota decepcionante,1,2,female,female,1.9,1.19721899973786,1.5,10,Era una nota musical.,Era una nota decepcionante.,Different Sense
458,6,órgano,Different Sense,Tenía un órgano eclesiástico,Tenía un órgano operado,1,2,male,male,1.3,0.674948557710553,1.0,10,Tenía un órgano eclesiástico.,Tenía un órgano operado.,Different Sense
459,6,órgano,Same Sense,Tenía un órgano eclesiástico,Tenía un órgano ceremonial,1,1,male,male,2.8,1.3984117975602,2.0,10,Tenía un órgano eclesiástico.,Tenía un órgano ceremonial.,Same Sense
460,6,palma,Different Sense,Estaba en la palma de coco,Estaba en la palma derecha,1,2,female,female,1.8,0.918936583472681,1.5,10,Estaba en la palma de coco.,Estaba en la palma derecha.,Different Sense
461,6,palma,Different Sense,Estaba en la palma frondosa,Estaba en la palma izquierda,1,2,female,female,1.3,0.483045891539648,1.0,10,Estaba en la palma frondosa.,Estaba en la palma izquierda.,Different Sense
462,6,papa,Different Sense,Era una papa caliente,Era un papa conservador,1,2,female,male,1.0,0.0,1.0,10,Era una papa caliente.,Era un papa conservador.,Different Sense
463,6,papa,Same Sense,Era una papa majada,Era una papa caliente,1,1,female,female,3.2,1.47572957474524,3.5,10,Era una papa majada.,Era una papa caliente.,Same Sense
464,6,pasta,Same Sense,Le gustó la pasta dental,Le gustó la pasta blanqueadora,2,2,female,female,3.9,1.44913767461894,4.5,10,Le gustó la pasta dental.,Le gustó la pasta blanqueadora.,Same Sense
465,6,pastor,Different Sense,Era un pastor eclesiástico,Era un pastor de ovejas,1,2,male,male,2.3,1.25166555703457,2.0,10,Era un pastor eclesiástico.,Era un pastor de ovejas.,Different Sense
466,6,pastor,Same Sense,Era un pastor montuno,Era un pastor de ovejas,2,2,male,male,2.7,0.948683298050514,2.5,10,Era un pastor montuno.,Era un pastor de ovejas.,Same Sense
467,6,pata,Same Sense,Ella vio la pata de la mesa,Ella vio la pata de hierro,1,1,female,female,3.4,1.7763883459299,4.0,10,Ella vio la pata de la mesa.,Ella vio la pata de hierro.,Same Sense
468,6,patrón,Different Sense,Era un patrón exigente,Era un patrón geométrico,1,2,male,male,1.6,0.843274042711568,1.0,10,Era un patrón exigente.,Era un patrón geométrico.,Different Sense
469,6,perfil,Different Sense,Se trataba de un perfil psicológico,Se trataba de un perfil elegante,1,2,male,male,2.8,1.31656117720877,3.0,10,Se trataba de un perfil psicológico.,Se trataba de un perfil elegante.,Different Sense
470,6,perfil,Same Sense,Se trataba de un perfil psicológico,Se trataba de un perfil perturbador,1,1,male,male,3.8,1.22927259430572,4.0,10,Se trataba de un perfil psicológico.,Se trataba de un perfil perturbador.,Same Sense
471,6,periódico,Same Sense,Se trataba de un periódico local,Se trataba de un periódico global,1,1,male,male,4.8,0.421637021355784,5.0,10,Se trataba de un periódico local.,Se trataba de un periódico global.,Same Sense
472,6,prima,Different Sense,Era una prima costosa,Era una prima hermana,1,2,female,female,1.5,1.26929551764398,1.0,10,Era una prima costosa.,Era una prima hermana.,Different Sense
473,6,pupila,Different Sense,Tenía una pupila contraída,Tenía una pupila estudiosa,1,2,female,female,1.9,1.19721899973786,1.5,10,Tenía una pupila contraída.,Tenía una pupila estudiosa.,Different Sense
474,6,químico,Different Sense,Era un químico exitoso,Era un químico orgánico,1,2,male,male,2.8,1.68654808542314,3.0,10,Era un químico exitoso.,Era un químico orgánico.,Different Sense
475,6,químico,Different Sense,Era un químico exitoso,Era un químico tóxico,1,2,male,male,1.9,0.875595035770913,2.0,10,Era un químico exitoso.,Era un químico tóxico.,Different Sense
476,6,revista,Different Sense,Era una revista de belleza,Era una revista brillosa,1,2,female,female,3.4,1.42984070596848,3.5,10,Era una revista de belleza.,Era una revista brillosa.,Different Sense
477,6,revista,Different Sense,Era una revista de belleza,Era una revista estrujada,1,2,female,female,3.8,1.13529242439509,4.0,10,Era una revista de belleza.,Era una revista estrujada.,Different Sense
478,6,rosa,Same Sense,Era una rosa fragante,Era una rosa frágil,1,1,female,female,4.1,0.875595035770913,4.0,10,Era una rosa fragante.,Era una rosa frágil.,Same Sense
479,6,sangre,Same Sense,Él tiene sangre noble,Él tiene sangre real,2,2,female,female,5.0,0.0,5.0,10,Él tiene sangre noble.,Él tiene sangre real.,Same Sense
480,6,semilla,Different Sense,Era una semilla cultural,Era una semilla germinada,1,2,female,female,1.9,0.737864787372622,2.0,10,Era una semilla cultural.,Era una semilla germinada.,Different Sense
481,6,serie,Different Sense,Se trataba de una serie televisiva,Se trataba de una serie matemática,1,2,female,female,1.9,1.10050493461461,1.5,10,Se trataba de una serie televisiva.,Se trataba de una serie matemática.,Different Sense
482,6,sirena,Different Sense,Era una sirena mitológica,Era una sirena ruidosa,1,2,female,female,1.7,0.823272602348565,1.5,10,Era una sirena mitológica.,Era una sirena ruidosa.,Different Sense
483,6,sueño,Different Sense,Él abandonó su sueño,Él moría de sueño,1,2,male,male,1.9,1.19721899973786,1.5,10,Él abandonó su sueño.,Él moría de sueño.,Different Sense
484,6,tabla,Different Sense,Le gustó la tabla de madera,Le gustó la tabla de juego,1,2,female,female,2.6,0.843274042711568,3.0,10,Le gustó la tabla de madera.,Le gustó la tabla de juego.,Different Sense
485,6,taco,Different Sense,Le gustó el taco delicioso,Le gustó el taco del zapato,1,2,male,male,1.2,0.421637021355784,1.0,10,Le gustó el taco delicioso.,Le gustó el taco del zapato.,Different Sense
486,6,tecla,Same Sense,Tocó la tecla desafinada,Tocó la tecla afinada,2,2,female,female,4.4,1.34989711542111,5.0,10,Tocó la tecla desafinada.,Tocó la tecla afinada.,Same Sense
487,6,título,Different Sense,Le gustó el título halagador,Le gustó el título propietario,1,3,male,male,2.7,1.15950180872841,3.0,10,Le gustó el título halagador.,Le gustó el título propietario.,Different Sense
488,6,título,Different Sense,Le gustó el título profesional,Le gustó el título del libro,1,2,male,male,2.4,1.42984070596848,2.0,10,Le gustó el título profesional.,Le gustó el título del libro.,Different Sense
489,7,algodón,Different Sense,Evaluó el algodón cultivado,Evaluó el algodón caramelizado,1,2,male,male,2.15384615384615,1.34450448407296,2.0,13,Evaluó el algodón cultivado.,Evaluó el algodón caramelizado.,Different Sense
490,7,arte,Different Sense,Se trataba del arte de guerra,Se trataba del arte renacentista,1,2,male,male,3.07692307692308,1.32045058354705,4.0,13,Se trataba del arte de guerra.,Se trataba del arte renacentista.,Different Sense
491,7,arte,Different Sense,Se trataba del arte de mentir,Se trataba del arte renacentista,1,2,male,male,1.84615384615385,1.06818801763811,1.0,13,Se trataba del arte de mentir.,Se trataba del arte renacentista.,Different Sense
492,7,banco,Different Sense,Era un banco exitoso,Era un banco plástico,1,2,male,male,1.53846153846154,0.967417922046845,1.0,13,Era un banco exitoso.,Era un banco plástico.,Different Sense
493,7,baño,Different Sense,Disfrutó el baño frío,Disfrutó el baño privado,1,2,male,male,3.23076923076923,1.53589529557661,3.0,13,Disfrutó el baño frío.,Disfrutó el baño privado.,Different Sense
494,7,calle,Same Sense,Condujo en la calle asfaltada,Condujo en la calle resbalosa,2,2,female,female,4.84615384615385,0.554700196225229,5.0,13,Condujo en la calle asfaltada.,Condujo en la calle resbalosa.,Same Sense
495,7,cámara,Different Sense,Se trataba de la cámara gubernamental,Se trataba de la cámara remodelada,1,3,female,female,2.69230769230769,1.60128153805087,2.0,13,Se trataba de la cámara gubernamental.,Se trataba de la cámara remodelada.,Different Sense
496,7,capa,Different Sense,Se trataba de la capa de superhéroe,Se trataba de la capa atmosférica,1,2,female,female,1.30769230769231,0.630425171956115,1.0,13,Se trataba de la capa de superhéroe.,Se trataba de la capa atmosférica.,Different Sense
497,7,capa,Different Sense,Se trataba de la capa de tela,Se trataba de la capa atmosférica,1,2,female,female,1.46153846153846,0.776250025806185,1.0,13,Se trataba de la capa de tela.,Se trataba de la capa atmosférica.,Different Sense
498,7,capa,Same Sense,Se trataba de la capa atmosférica,Se trataba de la capa de ozono,2,2,female,female,4.92307692307692,0.277350098112615,5.0,13,Se trataba de la capa atmosférica.,Se trataba de la capa de ozono.,Same Sense
499,7,cima,Different Sense,Estaba en la cima de la montaña,Estaba en la cima de su carrera,1,2,female,female,3.23076923076923,1.36344209960466,4.0,13,Estaba en la cima de la montaña.,Estaba en la cima de su carrera.,Different Sense
